,Review_ID,Rating,Year_Month,Reviewer_Location,Review_Text,Branch,dominant_topic,feature name
0,670571027,2,2019-4,Australia,"Feel so let down with this place,the Disneyland train was fantastic until you get past the station,bad signage, terrible staff who just did not want to be there ,it was rainning and rides were not working could not find a map of place, over priced fun park. Disney characters only 2 seen under a cabana having photos with visitors queuing up in the rain. Dont waste your money. Walt Disney would be horrified, not enough eating places for the amount of people or rest rooms. Seems they are building something but who knows what. No atmosphere of fun and fantasy. ",Disneyland_HongKong,9,park disnei ride disneyland time visit hong dai queue small peopl food hk kong wait
1,664668402,2,2019-4,Singapore,"I went to HK Disneyland on 5 April which happens to be Qing Ming festival and did not expect the massive crowds on that day. Queues for rides and F&B outlets were very long and we did not have a great experience especially with a young kid. For the amount spent on the tickets, it's really a waste of money as we only sat on a few rides. I'm wondering if the park has any cap on the number of guests in the park as we had a hard time finding seats around. I booked my tickets via the Disneyland Hotel online but there was no info or confirmation given to me whether my park tickets are booked. In the end, I was unable to enter and had to buy tickets on the spot. Luckily, one of the cast members, Carmen, helped us to resolve the issue and let us access without queuing up again. Also the balloons there are overrpriced   HK150 for a helium balloon.",Disneyland_HongKong,9,park disnei ride disneyland time visit hong dai queue small peopl food hk kong wait
2,663362365,2,2019-3,Canada,"Didn   t feel the Disney spirit in this place. There were few Disney characters around, but one must wait in long lineup to shake hand with them. We stayed for only couple hours and left.",Disneyland_HongKong,9,park disnei ride disneyland time visit hong dai queue small peopl food hk kong wait
3,662641193,1,2019-3,India,"The main attractions were shut while we still paid the full entrance fees, without any intimation either online or as the ticket kiosks",Disneyland_HongKong,9,park disnei ride disneyland time visit hong dai queue small peopl food hk kong wait
4,660285578,2,2019-3,Canada,"Very very small, disappointing all along the line... the park is too small, without big attractions. In 3 hours you will have seen everything. There was construction with a lot of noise during our visit. It was ridiculous to visit the enchanted forest when you heard a jackhammer!! The maneges are limited. The prices are high for the quality of the park. It is better to keep your money and invest it in another activity ",Disneyland_HongKong,9,park disnei ride disneyland time visit hong dai queue small peopl food hk kong wait
5,658697573,2,2019-2,United Kingdom,"As my husband and I had a free day before we flew back home , decided to visit here, being that as we are over the age of 64 we got entry of just under   10 each depending on the currency rate. This park does not open until 10.30am, but we arrived earlier as we decided to buy our ticket on the gate rather than do this by phone. Surprisingly enough it was a very easy and quick process, just had to show our passportsWe got on the metro from Hong Kong to Sunny Bay station, crossed the platform to catch the Disneyland train which was only one stop.Seeing that this was a Monday the amount of people waiting for the park to open was massive, bug bear is that nearly everyone is on their phones and then you have to put up with them doing a 101 selfies. (please if you love yourself that much just get a mirror). Anyway the announcement was NOT TO RUN when they opened the gates, BUT WHAT did they all do RUN, no manners at all, push and shoved.This park is not a patch on the original Disney in Florida. There are very few rides and you can get round this park so quick. This is certainly not worth the   60 plus for adults .The atmosphere is certainly not here either, maybe because it was not very warm.",Disneyland_HongKong,9,park disnei ride disneyland time visit hong dai queue small peopl food hk kong wait
6,658624005,1,2019-3,United Arab Emirates,"Visited Disneyland Hong Kong today March 15, 2019. Poor experience. Very little there in the first place in terms of rides and other experiences. But most of it was closed for renovations (including the main Disney castle) or lots of stuff just not open anyway. Kids couldn't get pics with their fav characters as they kept disappearing for a break every 20 mins and queues were long already. All this missing and not even a reduction in the already expensive price. Pretty crappy day outSmall park, half open. Not worth the money.",Disneyland_HongKong,9,park disnei ride disneyland time visit hong dai queue small peopl food hk kong wait
7,656647372,2,2018-11,Singapore,Overcrowded with Chinese tourist who likes to take photos of cute young children without permission. The rides are fun but taking too long to queue. Food offering is good.,Disneyland_HongKong,9,park disnei ride disneyland time visit hong dai queue small peopl food hk kong wait
8,655940742,2,2019-2,Australia,"One of the group had been to Disneyland in Japan and wanted to go to this one.I had been told was the staff are very friendly, welcoming and peppy plus the mascots milling about and very fun. Don   t know if upwelling went on a bad day or something but it was not a great experience. With the exception of two staff none of them smiled or made you feel welcome. As to for the mascots, finally saw them at the end of our day and only in the    town    part.Costumes were ruined by staff wearing black running shoes. OK they are on their feet and need to be comfortable but it was seriously jarring. Staff get a 2 10.Things like the recycling bin being loaded and taken away to be emptied but not one put in to replace. Tables not being cleared.Two of the restaurants were shut, a number of the rides were closed, the castle was shut.At HK$620 it was not worth the money. I was told Disneyland HK was loosing money and I am not surprised.We went on a number of rides and they all had positives. Loved the Ironman ride, Starwars and the roller coaster in the Gulch.",Disneyland_HongKong,9,park disnei ride disneyland time visit hong dai queue small peopl food hk kong wait
9,653876809,2,2019-2,Canada,"So much of the park is closed!! Very disappointing   only a few rides In the park. I do know there is an expansion planned, but so much was closed now, I don't know how they can afford to expand! I knew it was a small park before we went, but it is lacking the 'Disney' in every aspect... other than the cost! It is really easy to get to on the MTR and good for about 3hrs of entertainment If you are looking for something different to do while visiting HK.",Disneyland_HongKong,9,park disnei ride disneyland time visit hong dai queue small peopl food hk kong wait
10,649697067,2,2019-2,Indonesia,I love Disneyland but I wouldn't recommend Hongkong Disneyland.The reasons are:1. The staffs in Hongkong Disneyland not good like Disneyland or disneysea tokyo. They're very rude n not polite. Difficult to speak in English.2. Better I went to Dufan Jakarta than Disneyland Hongkong. I heard staff shouting the people who lining the attraction.3. No smile from the Disneyland Hongkong staff.,Disneyland_HongKong,9,park disnei ride disneyland time visit hong dai queue small peopl food hk kong wait
11,649615606,1,2019-2,Macau,"Every year I come to Disney with my children, every year is worse than the last one!!!!Prices for entrance tickets are outrageous, specially taking in account that the rides are minimal...Food prices are not normal, even for Disney, super hyper expensive, horrible food, even the junk food is tasteless!!!Only good thing about this place is leaving it!!!!",Disneyland_HongKong,9,park disnei ride disneyland time visit hong dai queue small peopl food hk kong wait
12,649505825,2,2018-12,South Africa,"If you going for the Disneyland adventure this is not the place. The price to enter is ridiculously high and don   t bother with the skip line thing coz it   s just not worth it, if you get there early enough you will get to go on all the rides before lunch and then you have been on them all. The famous Disney castle was undergoing a renovation that was not indicated on their website or at the gate. From the drinks to food and all those stupid little shops everything is way overpriced. The photo below was taken at 11:00. ",Disneyland_HongKong,9,park disnei ride disneyland time visit hong dai queue small peopl food hk kong wait
13,648300626,2,2019-1,Canada," Too experience to visit ,for over $600 Hk , every things so crazy , waiting time for any ride well over one hours ! washroom is closed to one and half hours wait ,poor ladies 1,the foods is so pricey ever Micky would not buy it ,people ,people ,people ! it is a small kingdom with no local want to come ,no wonder they lost money every year ,better off save time and moneys do some things else ,you will thank me for it !",Disneyland_HongKong,9,park disnei ride disneyland time visit hong dai queue small peopl food hk kong wait
14,647822351,1,2018-10,Canada,"I'm writing an honest and truthful opinion of this park. I'm not paid by anybody to discredit Disney. If you in HK, do not go to this rip off expensive overpriced park, which is not even worth HK$10 let alone paying over HK$400. There's no attraction, the rides are garbage, no decent food court and the price of the food is three to four time the price. this theme park is just as big as the Victoria Park in HK.Those who are commenting about how wonderful the time they had must have been paid by Disney or high with something. I would rather go to Ocean park which is much bigger and more things to see and do.Just to get to Disneyland you are paying US$ 15 20.",Disneyland_HongKong,9,park disnei ride disneyland time visit hong dai queue small peopl food hk kong wait
15,647328225,1,2019-1,Australia,"Visited from Australia. Enjoyed the rides, parades and shows. Disappointed the toy train ride was closed. Knew the castle would be under renovation. The biggest let down was that as we were leaving, we decided to pop by the gift shop to buy a Mickey and Mini Mouse plush toy (in the Chinese outfits) which was under the sign that said 2 for HKD298. When we went to pay, the girl behind the counter said it was HKD168 each. We took her colleague to show her the offer sign and she said it didn   t apply for Mickey and Mini, but that it was for other plush toys (Duffy and friends toys only). The girl was very condescending and made us feel unpleasant. So we accepted and bought it for HKD336. When we left to Hong Kong airport 2 days later, at the Disney store in the airport (we didn   t know there would be one there) we saw the same deal: 2 plush for HKD298 and we asked if it applied to the same Mickey and Mini mouse, and lo and behold the girl at that store said it did! that is, 2 for HKD298!! So how is it that at Disneyland park the store did not honour the offer when the other store did? We were very disappointed that the staff were very rude when we tried to enquire about the offer that was rightly given to everyone at the airport store, but did not give us this offer when it was clearly stated on the stand in the main Disneyland?!? This made what would have been a great day at Disneyland very unpleasant. We have discouraged our family & friends to visit Hong Kong Disneyland due to this unpleasant experience. Disney, we would like you to be more honest in your promotions and to honour what is stated in your pricing. ",Disneyland_HongKong,9,park disnei ride disneyland time visit hong dai queue small peopl food hk kong wait
16,646753240,2,2019-1,United Kingdom,they don't have as many rides as other Disneys.  Easy to get to.  Charge a fortune for bag storage but there are cheaper lockers if your bag is not big. Castle is still being built so not great yet.,Disneyland_HongKong,0,lose storag bowl bag noodl shorter easi dug msg instant grandpa blast forgotten turkei starv
17,642534419,2,2018-12,Singapore,Our two day visit to Disneyland was a bitter disappointment. The park was so busy you could not move around freely. The average wait time for each ride was 60 minutes. There is no option of a fast pass as is the norm in many other theme parks around the world. We did not see the Disney Princesses for a photo opportunity (which was the only reason my youngest two wanted to go to Disneyland) and all the other photo opportunities were full before we even arrived at the destination. The train around the park only went one way and did not return to its point of departure. The lines for coffee and food resulted in is leaving the park earlier than we anticipated because the wait was too long. A very disappointing experience to say the least and we will not be back! Please do not visit during the Christmas New Year season!,Disneyland_HongKong,9,park disnei ride disneyland time visit hong dai queue small peopl food hk kong wait
18,638511615,2,2018-11,Philippines,"When we arrived there the castle was closed and some other rides were not operating, but still had to pay full price. We ate a meal there and it was absolutely tasteless, in fact the worst meal i have had for years.We ordered Shabu Shabu from the Japanese outlet. I wanted to order fish & chips from somewhere near the goldmine but the restaurant was closed.Corn on the cob about US$6, ice cream terribly expensive. My wife enjoyed visiting Disneyland, seeing a couple of parades, a couple of shows and many photos but it would have been more enjoyable if we had children. BUT i am sure it would have cost a lot more because they would be wanting ice cream, toys, pop corn drinks etc and i would not have been prepared to pay these ridiculous prices.",Disneyland_HongKong,9,park disnei ride disneyland time visit hong dai queue small peopl food hk kong wait
19,637203765,1,2018-11,Thailand,"Full of Mainland tourists, spitting and pushing and shoving. IS NOT THE HAPPIEST PLACE ON EARTH!!! Expensive!!",Disneyland_HongKong,9,park disnei ride disneyland time visit hong dai queue small peopl food hk kong wait
20,633941812,1,2018-7,Hong Kong,"Dumb to go.America Street is a boring place because the prices ain't cheap and much can be bought elsewhere.The other zones are horrible,with too much people and staff not doing much for the adventure.Very unhappy during the whole trip.",Disneyland_HongKong,9,park disnei ride disneyland time visit hong dai queue small peopl food hk kong wait
21,633170265,1,2018-11,United Kingdom,Having visited Disneyland Paris some 25 years ago we decided to spend the last day of our holiday at Disneyland Hong Kong. The rides were outdated and given HK love of all things electronic we expected more. There was a greater variety of rides in Paris. The parades started late   so we missed the last few minutes of the evening parade as we had a coach pick up to meet. The parades were not a patch on Paris some 25 years agoThe majority of the staff were rude and unhelpful   unlike the Paris staff. Given that English is widely spoken in HK a lot of the staff barely understood English. Putting it mildly it was an utter disappointment from start to finish.,Disneyland_HongKong,9,park disnei ride disneyland time visit hong dai queue small peopl food hk kong wait
22,632355808,2,2018-11,Singapore,"Hong Kong Disneyland is just too small with limited rides compared to parks in California, Tokyo or Paris. A little disappointing but the kids (10 and 13) enjoyed it all the same   it   s Disney after all!! A good place to spend the afternoon if you have time to spare, otherwise I would give it a miss.",Disneyland_HongKong,9,park disnei ride disneyland time visit hong dai queue small peopl food hk kong wait
23,631119122,1,2018-11,Philippines,Extremely average rides. Please save your money and go to Universal Studios in Singapore! They don   t get anywhere close to creating the magical experiences they promise to! The park was too crowded with sections shut down for renovations. After paying for an entry it seemed like you are eternally in a queue for rides or exhibits that were extremely disappointing!,Disneyland_HongKong,9,park disnei ride disneyland time visit hong dai queue small peopl food hk kong wait
24,629833707,2,2018-10,Singapore,Was quite disappointed as the castle was under renovation hence no fireworks. The characters roaming around the park was limited. The street march ended very fast.,Disneyland_HongKong,9,park disnei ride disneyland time visit hong dai queue small peopl food hk kong wait
25,629547840,2,2017-11,Hong Kong,"Yikes, the worst thing about HK Disneyland is the never ending same same music, over and over again, the same tunes. Omg I could pull my hair out, I would seriously go bonkers if I had to work there. When my kids were small, we went many times and I have to say, they absolutely loved it every time. We even discovered that the best time to go is in the pouring rain as no one else is there and there are no queues! If it suddenly brightens up it will be about 2 hours before the crowds return, that, my friends, is a very good tip. Nowadays we never go and stuff like that I avoid like the plague but if you've got young kids then you just have to take them, they will love it. Remember tho, it's crowded as all hell, expensive, you can't take your own food so you are forced to eat at the restaurants and even buy water and the queues are long. I used to smuggle in sandwiches under a dark piece of cloth at the bottom of my bag, you can get stuff in if you hide it well. Enjoy x",Disneyland_HongKong,9,park disnei ride disneyland time visit hong dai queue small peopl food hk kong wait
26,624884437,2,2018-5,United States,The Disneyland here is way too commercialized   too many stores than rides compared to the ones in US!My brother did not enjoy it since the ultimate night show was cancelled & that was not announced in their website!It was a big disappointment for my supposed to be treat!,Disneyland_HongKong,9,park disnei ride disneyland time visit hong dai queue small peopl food hk kong wait
27,624183786,2,2018-10,Australia,"When it comes to Disney, you expect wonderful things, but we were very disappointed with our overall experience here on our recent visit. The park is very small and doesn't have the magical vibe that Anaheim Disneyland exhibits. The majority of staff that we encountered had the personalities of bricks and showed no happiness or excitement. Food options were very average and opportunities for photos with characters were limited. With the park closing at approx 8:45pm on the day we visited, photos with Mickey and Minnie were closed off at 4pm, causing much disappointment from numerous visitors. The general upkeep of the park also seemed quite poor, with overgrown gardens and dirty grounds in some areas. While there was the advantage of much shorter queues for rides, this Disneyland just feels like another average theme park and doesn't even come close to comparing with the original in Anaheim. I wouldn't recommend visiting this theme park. ",Disneyland_HongKong,9,park disnei ride disneyland time visit hong dai queue small peopl food hk kong wait
28,622773202,2,2018-10,Australia,"When we planned our trip to Hong Kong we didn't realise that we would be there for the Mid Autumn Festival. When we went to Disneyland on the Sunday before the Festival we didn't realise that the line to get into the park would be over an hour long at 10am. The heat was oppressive and there was far too little shade and water dispensers available. After waiting, waiting and waiting we gave up by 3pm (after only getting in at 11am!) and left.The park is very small compared to other Disneyland's but the crowds at the bag check at the entrance were like I have never, ever seen before. Crazy!",Disneyland_HongKong,9,park disnei ride disneyland time visit hong dai queue small peopl food hk kong wait
29,621625152,2,2018-1,Hong Kong,"Only go here if you have never been to a Disneyland before, or you are one of those people who are crazy for Disney. It   s small. Really small. You can do the whole park in a half day. Don   t go on a Chinese Holiday or it will be flooded with Mainland Chinese tourists. Pretty much the same as every other Disneyland just 10% of the size. Take advantage of the fast pass system. If your ticket is crumpled or broken and the machine won   t accept it, there is a small inconspicuous button on the back of the fastpass machine that will print a fast pass ticket for you. Unscrupulous visitors can press it repeatedly to get multiple rides without waiting in line. Visit the rides that don   t have fast pass first or last thing. Stay late for the fireworks over the castle.",Disneyland_HongKong,9,park disnei ride disneyland time visit hong dai queue small peopl food hk kong wait
30,620582661,2,2018-9,United States,"Second time here in 11 years and my first visit was better. Trying to celebrate our honeymoon in 1 of 3 Disneylands. They don't have a good pin selection here  just stickers? Not impressed since we traditionally get pins from Disney world every time we go. Customer service is not Disney level. People avoided eye contact, only approached us at the dining cafe when we we're signaling for help, and some cast members were on their cell phones! We we're trying to buy storm trooper magnets and we had to wait for someone to look up from their phone and ring us up. The roller coasters are fun and there were no lines it being a Wednesday. Super clean bathrooms and park. Toy story land is small but the rides are good for kids. They decorated for Halloween so it was enjoyable to see. Due the damages from the typhoon, the jungle cruise was closed  no biggie but I probably won't want to come back specifically for that ride. Thank goodness for the good company I was with. He was able to point out the fun Disney decor. Which is what I love about Disney parks.",Disneyland_HongKong,9,park disnei ride disneyland time visit hong dai queue small peopl food hk kong wait
31,620491395,2,2018-9,Vietnam,"The services compare with the opening period is totally different.1  Guide and map is not easy for traveller organize they own plan as the date before. It   s must be spend more time for the whole trip. 2  The show (Lion king my favorites show) not such carrying the same feelings. Less actress and not monumental anymore.3  The souvenirs quality honestly really    China   , such like the things you can find in Mongkok market.Hope its will help you somehow. Thank you.",Disneyland_HongKong,9,park disnei ride disneyland time visit hong dai queue small peopl food hk kong wait
32,618076912,1,2018-9,Philippines,"Its not the fault of Disney that such a bad typhoon storm hit and closed and disrupted operations. It is their fault and responsibility in how they handle the ensuing customer issues.When we explained to Mr.Dominic Chanat the Hong Kong Disneyland Reservation Center that we travelled far with our kids, paid for plane tickets, paid hotel, etc and bought silver passes to the park and had limited time he didnt seem to care. The park was closed during our stay for one day and many things in the park were not running or closed. All we asked was to be able to use our passes on Saturday to make up for the closed day and the other problems as we leave Sunday.He gave us the magical template answer with a NO, passes cant be used on Saturday with no consideration. Greed before customer concern is how they responded to the aftermath of the storm.The park is currently in disarray and best to avoid until they get the place fixed up and can ensure us that all the attractions have been inspected for safety due to storm damage that may compromise safety.",Disneyland_HongKong,9,park disnei ride disneyland time visit hong dai queue small peopl food hk kong wait
33,618046367,2,2018-5,United Kingdom,"What can I say, having been to the USA and to Disney Paris, this one is the worst one so far. Expensive to enter, expensive to buy water and food.Gifts were over priced too.Totally disappointed that there were no big rides, everything seemed geared towards young children, nothing for us big kids.Don't waste your money, save up and go to the USA, the best Disney by far.",Disneyland_HongKong,9,park disnei ride disneyland time visit hong dai queue small peopl food hk kong wait
34,616762994,2,2018-9,Hong Kong,"We found this the worst Disney Park around the world. It's far too small, not at all immersive in some areas. The castle was very small too, it just didn't have the magic. On a bright note, it's easy to get too for a quick few hours.",Disneyland_HongKong,9,park disnei ride disneyland time visit hong dai queue small peopl food hk kong wait
35,615139075,1,2018-8,United Kingdom,"Hugely expensive (  126.40 for one adult and one 14yo.) for what surely must be the smallest of Disney's park offerings. If you expect western style junk food, think again, this was worse. The rides were good. Queue discipline was at times bad with ignorant people shoving their kids past us and when their kids cried out that the adults couldn't get by to join them, we reluctantly let them through too. The fairytale castle, tiny as it is was behind hoardings as I guess they were working to add extra magic with the diggers that were there. Go to Ocean Park instead.",Disneyland_HongKong,9,park disnei ride disneyland time visit hong dai queue small peopl food hk kong wait
