,Review_ID,Rating,Year_Month,Reviewer_Location,Review_Text,Branch,dominant_topic,feature name
140,432626109,2,2015-11,China,"Took my kids there, long lines and boring rides, and they don't even have the haunted house....I won't go there again.",Disneyland_HongKong,9,park disnei ride disneyland time visit hong dai queue small peopl food hk kong wait
141,430844106,2,2016-10,Singapore,"IMO very badBeen to japan one and hk seems to be very pale in comparisionKids always enjoy the parade but the parade at 3pm only feature1   mickey2   minnie3   goofyWhilst the park at tokyo feature the entire cast of the parksAlso due to low season, a lot of eateries not openWeather is hot to enjoy the ridesRecommend go in cooling season",Disneyland_HongKong,9,park disnei ride disneyland time visit hong dai queue small peopl food hk kong wait
142,430571237,1,2016-10,Australia,"Absolute waste of money spent aud182 for 2 adults soaked from pouring heavy rain with no rides or outdoor parades being operational.With a 2 year old in tow it was horrible. If parades and rides are cancelled how do you expect patrons to enjoy the full potential of a once in a life time family day out? Complained to manager who wouldn't even budge to give money back or discount. Spent $200 at the Disney store, had lunch and enough was enough so caught mtr back to hotel.So annoyed I could have saved $182 entry fee if I had known there was a Disney store in HKG airport.",Disneyland_HongKong,9,park disnei ride disneyland time visit hong dai queue small peopl food hk kong wait
143,428969045,1,2016-10,Philippines,We entered Disneyland at 1pm. The sad thing is they closed all outdoor rides at 1:30 pm. Well they should have informed us before we bought the tickets. We went to Hongkong just to go to Disneyland. The tickets cost us more than 10k pesos (1617 HKD). They already know they're gonna close based on the forecast and yet they still let us buy the tickets. We only stayed inside for an hour or so. We just took pictures and rode the hyperspace mountain and took off. Bad experience. They only want the money... and didnt care if we lose it. ,Disneyland_HongKong,9,park disnei ride disneyland time visit hong dai queue small peopl food hk kong wait
144,428630332,2,2016-10,Singapore,"Visited with 2 young children. Train to Disneyland is nice. Visited on wkday and not much crowd, short waiting time. Some pushcarts and a few eating places not operating. No selfie stick is allow. The food are expensive. 99% of the staff( fr restaurant or shops or rides assiatance) we came by are unfriendly, no smile and rude. The 1st rude staff is at the self  help ticketing station who keep saying 'no no no no' while walking towards us. These staff really spoil our day. Put on mozzie patch or repellent. Me and my hubby got biten all over the legs which the red spots last many days.Most of the rides are for young children, not much for adult. 2 days visit is good if u want a more relax trip especially with children. We spent 3 4 of the day during the 1st day and half a day on 2nd day for night view. Our verdict: japan disneyland is so much better and fun. Will not revisit in the next few yrs.",Disneyland_HongKong,9,park disnei ride disneyland time visit hong dai queue small peopl food hk kong wait
145,427462614,2,2016-10,Hong Kong,HKG Disneyland was an expensive disappointment. Time and money better spent !  Go to Ocean Park.  Especially if your hotel is on the Island side.,Disneyland_HongKong,9,park disnei ride disneyland time visit hong dai queue small peopl food hk kong wait
146,426838264,2,2016-7,Singapore,"It was my first visit to Disneyland so we do not know what to expect. went with extended family with 3 toddler. did not expect Hong Kong Disneyland to be influx with mainland China customer which cut queue, pushing from behind all the while in Disneyland. working staff is way too little, did not have anyone to control the crowds and their behaviour. it was just a very bad experience at Disneyland. Food was terrible yet at exorbitant price. definitely will not recommend any tourist to visit. it will be a whole day wasted.",Disneyland_HongKong,9,park disnei ride disneyland time visit hong dai queue small peopl food hk kong wait
147,425282027,2,2016-10,Australia,The price to get in here was pretty steep for what you get for it. The Gulch mine cart ride was well worth it and the boat trip around the island at adventure land (I think) was entertaining. The Star Wars ride was thrilling through pitch darkness but the wait for this ride was ridiculous and no fans or coolers to keep such a large number of people cool in high heat and humidity while they wait. We just waited for long periods of time in line after line for short rides. There weren't too many spots to sit down to rest and you could only buy the designated branded items on sale at their high prices for food and drinks. The family were pretty frazzled by early afternoon and we pulled the pin only to have to wait in lines for the train to stand all the way back to the hotel. ,Disneyland_HongKong,9,park disnei ride disneyland time visit hong dai queue small peopl food hk kong wait
148,422692710,1,2016-9,Hong Kong,"On our visit the fireworks were cancelled, the Halloween Event cancelled, there were only two Disney Characters we saw in the park, 60% of the restaurants were closed and we cant access on the web the pictures we paid Disney for. All in all a very disappointing days outing. The park is not what is was and certainly not worth the entrance price.",Disneyland_HongKong,9,park disnei ride disneyland time visit hong dai queue small peopl food hk kong wait
149,422281845,2,2016-8,Hong Kong,"yes this is the smallest of the disney parks, do you need a fully day here, well no. It was busy and hot and several rides had broken down including the rollercoaster and also the car racer in toy story land. They also closed 3 lands at 5pm for a private function, if i knew that I would not have booked as this was not on the website!",Disneyland_HongKong,9,park disnei ride disneyland time visit hong dai queue small peopl food hk kong wait
150,420042917,1,2016-9,Singapore,"The service staff Manning the queue at Cinderella photo taking spoil the day for my whole family.Incident happened on 19sept2016 at around 1240pm.was directed to push my baby pram underneath the queue line then when I was trying to get under the queue line,the guy then pulled the rope quite forcefully and it hit my head which he did not even apologise but instead he shouted in a very rude manner.pls note that I do not understand Cantonese and I was just following his gesture.Super bad experience manz.doesnt reflect on Disney at all.does Disney encourages violences and rudeness as well as bad service and attitude?",Disneyland_HongKong,9,park disnei ride disneyland time visit hong dai queue small peopl food hk kong wait
151,419609295,2,2016-9,United States,"Visited Hong Kong Disneyland with my husband and three children, ages 7, 5, and 2. We had a beautiful, albeit very warm, day at the park. Having been to Disney World in Orlando several times, this park was much smaller scale and was a bit underwhelming by comparison. At the outset, we were frustrated because my husband purchased tickets to the park online upon our arrival at the park, and we were told we would have to wait one hour before we could gain entry, even though he had received a confirmation of purchase. Not what we wanted to hear when we had three eager children at the gates. We were really disappointed by the lack of characters to be found around the park. Plus, we tried to visit with Mickey and Minnie, Pluto and Jessie from Toy Story, and each time we were told to come back later, as they were closing for a break. It was a little frustrating that they don't have replacements available. We waited in long lines  generally 30 minutes to an hour for each ride  but we were there the day after a Chinese holiday so it is possible that we encountered higher than normal crowd volumes. This meant that in the 7 hours we stayed, we only rode 7 rides, and took one breaks for a beverage and one for lunch. In addition, they shut down three sections of the park at 4:30 for special events, which undoubtedly also contributed to overcrowding of the rides. The bad news covered, Toy Story Land was very unique and creatively designed, the park was well maintained, and the smaller size of the park made it manageable to navigate in one day, but I would not make a special effort to return.",Disneyland_HongKong,9,park disnei ride disneyland time visit hong dai queue small peopl food hk kong wait
152,419215485,2,2016-9,United Kingdom,"Did not think it's worth the money,does not compare to other Disney parks.Very compact and would not like to be their in peak season.The staff in the main are good and polite but board stiff (sorry disney)The site and toilets are very clean ,be prepared to Que for the few rides on the parkwould I go again NO",Disneyland_HongKong,9,park disnei ride disneyland time visit hong dai queue small peopl food hk kong wait
153,418171687,2,2016-1,Canada,"It's okay, it's small, are the rides shorter cause they feel shorter ?  I wunder if Shanghai Disney is a better day out .",Disneyland_HongKong,9,park disnei ride disneyland time visit hong dai queue small peopl food hk kong wait
154,417755999,2,2016-2,United States,"The park is so small, with so few people and performances that it is almost depressing. There are no new rides there either so if you are a long time Disney person you won't find anything new or exciting. You will be much more pleased with Shanghai Disney which is only a short two hour flight away.",Disneyland_HongKong,9,park disnei ride disneyland time visit hong dai queue small peopl food hk kong wait
155,415778097,1,2016-8,Spain,"The park is far too small for the amount of people that are entering. There are long wait times and queues for everything. Security is a joke   they don't actually tell you anywhere what you aren't allowed to take in which means that nobody knows and this creates a huge queue with people asking why they can't enter with things and arguing about where they can leave things to collect them on the return. The queue management for everything is just a disaster from buying tickets, queuing to get in and out of the park and buying food   it's slow and badly organised and if you go in the summer most of the time you are waiting outside in 30 degree heat. No ideal at all. There aren't many rides and you can probably do every single ride in the park in half a day if there were no queues. There was always a queue for the toilet and they were not kept very clean at all. Food and drink is expensive so I would recommend that you took your own   make sure your drinks are in a plastic bottle. The metro station is about a 5 minute walk from the park and be warned that at the end of the day you will have to wait a long time in complete chaos just to get into the metro station. Not sure why Disney doesn't offer a bus service to the park entrance from the metro station and the buses that take you to the hotels. Buses to hotels were also a complete disaster. You have to wait again in a long queue and the bus stops at the Disney World hotel first and then moves on to the Hollywood Hotel. Not sure why they can't have separate buses as it just makes the journey so much longer. Park was a big disappointment and I wouldn't recommend it to anyone. Hong Kong has another theme park which is called Ocean Park. It's much better than Disney, better value for money and better organised. Would not return here and would not recommend to anyone.",Disneyland_HongKong,9,park disnei ride disneyland time visit hong dai queue small peopl food hk kong wait
156,415568547,2,2016-9,Malaysia,"Part of it why I didnt enjoyed was because it was raining the day I went. And I found out they charged for the raincoat at HKD 65, and some of their rides are even closed.",Disneyland_HongKong,9,park disnei ride disneyland time visit hong dai queue small peopl food hk kong wait
157,413929881,1,2016-8,Nepal,"Disneyland is more like Lineland. There are lines for everything ranging from 20 to 50 minutes. It's exhausting with a little one. Even taking pictures with the characters. We stood 45 minutes in line to take a photo with mickey and minnie mouse. The characters in costumes keep taking breaks every 5 to 10 minutes probably because it's really hot and humid. They should have replacement people on rotation for how much they earn. Everything is overpriced and just full on capitalism and consunerism in all its glory. I paid 120 HKD for one helium balloon!!!! Only the food at this one Chinese noodle and rice place was reasonably priced. If your child is over 4 years old, well behaved, quiet, patient, won't drive you crazy trying to buy every Disney item, has no problem with heat humidity and rain, willing to walk by themselves everywhere then Disneyland hong kong is for you! Otherwise better to pay nothing and spend a day at the park! ",Disneyland_HongKong,9,park disnei ride disneyland time visit hong dai queue small peopl food hk kong wait
158,413730988,1,2016-9,Singapore,Someone is smoking inside the toilet. Inconsiderate tourists rudely cut in somewhere in the middle of the queue (it happens multiple times). My 3 year old Daughter is not happy because of the long queues. We ended going back to hotel early and decide not to complete all rides.Majority of tourists are inconsiderate! Management should do something.,Disneyland_HongKong,9,park disnei ride disneyland time visit hong dai queue small peopl food hk kong wait
159,413019621,2,2016-8,Philippines,My only comparison is the Disney land Paris which is huge comparing HK one.The most action oriented activity are the mine and the space roller coaster but they are both small and not that exceptional.Would work with the very young kids.For teens or adult it's boring...,Disneyland_HongKong,9,park disnei ride disneyland time visit hong dai queue small peopl food hk kong wait
160,411934979,2,2015-10,United States,I decide to go see this attraction to compare the ones in Anaheim and Florida ! Sad to say it's a total bust ! Long walk from parking to Disney Entrance gate ! Some major attraction were closed for maintenance! Long long lines to ride most rides! Food was total overcharge and plain average! Service ? Hah hah they think they doing u service by pointing out where I want go? So pity enough said about the Disney I remembered in USA ! That's a must see if u have young ones ! Really so pity! Andre,Disneyland_HongKong,9,park disnei ride disneyland time visit hong dai queue small peopl food hk kong wait
161,410691469,2,2016-5,Portugal,"It's a little difficult to describe the experience there... A lot of good things in the park, but a lot of bad things either... the staff is great and helpful... The food court is to avoid... The toilets needs to be cleaned more often, the attractions are typically Disney... Unbelievably expensive merchandise... Great fireworks at night... ",Disneyland_HongKong,9,park disnei ride disneyland time visit hong dai queue small peopl food hk kong wait
162,410400595,2,2016-8,United Kingdom,"Disney is a long way on the MTR but , it's still quick, when you get there the park entrance is a bit of a walk,    once there you will be in a fair size Q to get your ticket, when you get in there isn't much to do if your comparing it with any Disney park in Florida, we stayed at the Hollywood hotel for a night, it was fine as you would expect, it's a pity the hotel isn't closer to the park, when you get off the MTR you have to get in a Q for the bus to take you to the hotel, when you have checked in you get the bus back to the MTR station then you walk to the park entrance, once your there you can fight your way round the few attractions there are, the park when we visited seemed very overcrowded it was like sardines, too many people for the size of venue, getting back to the hotel was walk to the bus which is at the MTR Q up and get the bus to the hotel, quite a bit of faffing about for staying at a Disney hotel, they should have provided dedicated buses from the park To the hotels, Getting on the MTR for your return journey is again another Q and a wait, and it was hot, not a good combination.Iv only given this attraction a 2 but this might be because we have been to Disney in Florida and it's different.",Disneyland_HongKong,9,park disnei ride disneyland time visit hong dai queue small peopl food hk kong wait
163,408158351,2,2016-7,Australia,"I've only ever been to Paris Disneyland before HK Disneyland and when I compare it to that, HK is pretty disappointing. The excitement starts when you get on the Disneyland train of course and when you arrive, but when I saw the size of the castle I just laughed, that set the tone for the day.I was only able to go on a few rides and they were all very tame. To me it felt like it was missing a couple of exciting adult rides. The park itself is quite small and you can get around within 4 5 hours so it seemed to be better to go later in the day so that you could stay for the late show.Souvenirs were more for kids and greatly lacking in adult gifts, like glass items or other collectibles, couldn't even find any snowglobes.This place is an alcohol free zone also",Disneyland_HongKong,9,park disnei ride disneyland time visit hong dai queue small peopl food hk kong wait
164,406843321,1,2016-8,China,"Below was the email I sent to Disney Customer Service, your Director of Guest Experience Services Janet promised to contact me within 5 days BUT she DID NOT. Dear Sir or MadamI am writing this email after my recent depressing and discouraging visit to Hong Kong Disneyland with my mom and my daughter Emma dated 2 Aug 2016. It took several days for me to make this formal complaint because I want to make sure I was not outrageous for the time being but disheartened for good. I do hope you can take some of your time and hear out the story of what happened to us back then.We are Chinese citizens coming from Hainan Province. My daughter is four years old, and she is extremely eager to meet the princesses in person and take photos with them. Hong Kong Disneyland increased the price and Shanghai Disneyland recently opened notwithstanding, we still chose to visit Hong Kong Disneyland because we saw your MARVELOUS advertisement of your wonderful 10 YEARS ANNIVERSARY. We stayed in Hong Kong over the night of 1 Aug and arrived at the Park around 10:30 the next day. However, one hour after our check in when we are queuing up for the raft to the Tree House of Tarzan, the staff dismissed the queue and informed us that all the outdoor activities will be cancelled due to the  3 storm signal. No Cinderella. No Snow White. No Elsa. No Aurora. No Rapunzel. No parade. You cannot imagine how dispiriting and frustrating it was for the 4 year old little girl.It was the first time for Emma to visit an amusement park of its kind. To make this trip colourful and meaningful for her, I spent 8 weekends watching the Disney classic movies with Emma, especially the Disney Princess collections. We chatted over night to discuss which princess she liked the most. We played games together to recreate the scene of each princess movie. Unfortunately, it just turned out that the more you longed for meeting the princess, the more disappointing you got.From then on, at least 3,000 visitors thronged in door and heavily queued up for the only programs left over. We spent at least one and a half hour waiting for the small world. What is worse that we were informed that the park would be closed shortly due to the  8 storm signalI could not just believe it. The dinner was off the record because all canteens and shops in the park shut their doors suddenly. With no restaurants nearby, I had to bring little Emma of 4 and my mother of over 60 back to the downtown without dinner. Not to mention how disappointing we were leaving without seeing the fireworks.I know you would defend yourself using the typhoon excuse, and it is very true, nobody will deny it. Nevertheless, it is your cold heartedness and your negligence that irritate me. Nobody even showed the slightest care for the little boys and girls and the aged. YOU just THREW us out, which is the last thing I can imagine to happen in Hong Kong Disneyland. I cannot understand it and will not accept what had just happened to us. With the modern technology, you should know the typhoon is coming and you know much better than anybody exactly how it will affect the park. It seems to me that you just care more about the number of visitors rather than their expectations and experiences. Maybe you could close the Park for good and post an advance notice, or you could pretend to be sorry and try to be a little bit nicer to your guests, but you chose to do nothing. Oh, I am sorry that you did do something when you made a great effort to kick them out.I chose Hong Kong Disneyland over Shanghai because I believed your 10 years anniversary will be more wonderful than usual; because I believed your staff will be more civilized and more experienced, so that my daughter will enjoy her meeting with princess more happily. Sadly, it is such a fool of me to have believed all this and none of it came true. Of course, it is surely not a trip of empty hand. I   ve learned my lessons: never trust the illusory advertisement. I would love to share my experience with my friends and colleagues who just happen to have kids of the same age like Emma, and I am confident they must be smart enough to learn from mistakes and make correct decisions. Thank you very much for your wonderful service offered to Emma, and she will definitely not badger me again to bring her to any Disneyland around the globe.",Disneyland_HongKong,9,park disnei ride disneyland time visit hong dai queue small peopl food hk kong wait
165,406158287,2,2016-8,Canada,"As a Disney lover, I was so disappointed with Hong Kong Disney. With its next to no rides, disinterested staff, and general lack of spark and character, there was no magic to this kingdom.",Disneyland_HongKong,9,park disnei ride disneyland time visit hong dai queue small peopl food hk kong wait
166,403982917,2,2015-9,Hong Kong,"It's not what you expect from Disneyland, quite small, crowded of course and little boring also for kids",Disneyland_HongKong,9,park disnei ride disneyland time visit hong dai queue small peopl food hk kong wait
167,403903953,2,2015-12,United Kingdom,"Sorry, but I am not a big fan. It's part of the Disney corporation which simply fleeces people and families for nothing. The rides at HK Disney are nothing special, the food is terrible and they try to sell you plastic trash at every opportunity. Avoid. If you want to go to something like this visit 'Ocean Park'   it's 100 times better, easier to get to and educational, as well as having many more rides.",Disneyland_HongKong,9,park disnei ride disneyland time visit hong dai queue small peopl food hk kong wait
168,402422132,1,2016-8,Philippines,"On a 38C weather ...Pros: not too much people shorter Queue line great service rendered by Duffy & Shellie May shop Suet, helpful and initiate to have interaction with guests.Cons: Dirty everywhere, can't understand if this is Short handed or staffs just not attention to details instead of seeking interaction with guests, 95% of staffs were just Chatting with co workers aside from merchandise shop staffs, See No One Smiling .. Maybe it's Too Hot? But I don't this is a Reason, coz they keep Laughing while they chat totally cannot understand the announcement made in microphone, why are they hurrying what they wanna say?!?I mean we can understand all 3 languages, but I was wondering if staff are just trying to do it Fast or Afraid of talking in front of the mic? locomotive staff even PSSST!!! To guests who cant understand its only a one way train. Shouldnt he tell guest Politely? F&B: most of the Restaurants were fully occupied, went to Banquet hall & have a vegetarian cutlet, main dish & salad were fine, but tomota side dish .... Can be better. but over all, most Impolite staff ever seen ...Louise from Dumbo!!! I took a video on how she work, unfortunately unable to post it tripadvisor, anyway if anyone have a Chance of Experience her Services, you will understandhow Terrible she was. Its just No Passion   world Murdered her parents and she want to Take a Revenge to the world .. Everyone in this world is her Enemy!!!Overall experience: Bad attitude from most of the Staffs, but I do Believe this is a Hong Kong Culture .. Just being Impolite, but if you're Disney, then I guess you're carrying the Brand all over the world, & not just a local theme park.Lot of Space to Improve ... To be a Disney!",Disneyland_HongKong,9,park disnei ride disneyland time visit hong dai queue small peopl food hk kong wait
169,402077684,2,2015-9,Netherlands,"I remember visiting HK quite a number of years back with the school trip.This is the first Disney Land I have ever been to, most of the rides is short but fun.At the end of the day, there's a 10 15mins long of fireworks, it was spectacular and beautiful. If this is your first time visiting a Disneyland and never been to any before, you surely will be left in amaze and wow.But after been to several DL around the world, I had to say, this is one of the  smaller  version with shorter rides. It's tough call esp after you've visit several better ones around the world. But nonetheless, it's still a pleasant experience and a legit DL park compare to the rip off CN version.",Disneyland_HongKong,9,park disnei ride disneyland time visit hong dai queue small peopl food hk kong wait
