,Review_ID,Rating,Year_Month,Reviewer_Location,Review_Text,Branch,dominant_topic,feature name
378,169822430,2,2012-9,Hong Kong,"Been living in HK for the past 10 years and was looking forward to visiting Disneyland in 2006 when it was opened, what a disappointment!!! Nothing comparable to other Disneylands (France, USA...etc) in terms of size, entertainment, attractions, price, space, crowd etc...  Bonded with tourists...More",Disneyland_HongKong,9,park disnei ride disneyland time visit hong dai queue small peopl food hk kong wait
379,169742630,2,2012-8,Hong Kong,Any Disney afficianados will understand the title line which is probably as much as needs saying. Whilst well intentioned it lack sthe atmosphere some may be looking for.,Disneyland_HongKong,9,park disnei ride disneyland time visit hong dai queue small peopl food hk kong wait
380,169719869,1,2012-8,Hong Kong,"they spit and litter everywhere, also noisy tourists. As local we still don't get the point of why we have disneyland the tourist trap of staff trained to give you the commercialized smile and fairytale illusion. You don't see the real Hong Kong there. It...More",Disneyland_HongKong,9,park disnei ride disneyland time visit hong dai queue small peopl food hk kong wait
381,169678159,1,2013-4,Hong Kong,Small and disappointing. Really not worth visiting. The cable car to get there was probably the best bit.,Disneyland_HongKong,9,park disnei ride disneyland time visit hong dai queue small peopl food hk kong wait
382,168549347,2,2013-6,South Sudan,Ocean View still is better... I should have listened to the review.. Grrrr... The time I spent in HK Disneyland would have been better used in shopping... Grrrr,Disneyland_HongKong,9,park disnei ride disneyland time visit hong dai queue small peopl food hk kong wait
383,168503494,2,2013-6,Hong Kong,"The park itself is very well kept and a great place for the kids, but as a parent having to wait 50 minutes in line for nearly all rides and then getting a ride under a minute is completely unacceptable. The kids were so disappointed. Disney is far too greedy with this and I would probably not visit again because of this. What a shame.",Disneyland_HongKong,9,park disnei ride disneyland time visit hong dai queue small peopl food hk kong wait
384,168160996,1,2013-7,Singapore,The rides and all the other attractions are created only for kids. We went with an expectation of a similar experience as Universal studios SG. I guess for that you should try the Ocean Park,Disneyland_HongKong,9,park disnei ride disneyland time visit hong dai queue small peopl food hk kong wait
385,166035594,2,2013-6,Philippines,"The park was great, and everything. Long lines for the characters, but that is to be expected. Had one issue at the restaurant across from the jungle cruise called Riverview Cafe. Seemed they did not like I was American, who knows. My gf and I ordered food, then two couples came after us and ordered. They ordered heaps of food, we just ordered fried rice and coke. The two couples received all of their food, portion after portion while my gf and I were starving and looking at the other couples with envy. As soon as I spoke to the manager our food came. Call it coincidence or not, but we immediately left and refused to pay. Who knows the true story, but we ate at a different restaurant called The Explorers Club and it was excellent. Just Avoid the Riverview Cafe.",Disneyland_HongKong,9,park disnei ride disneyland time visit hong dai queue small peopl food hk kong wait
386,164147693,1,2012-10,United Kingdom,We went here on my birthday honeymoon and out of everywhere I visited in Hong Kong this was the worst experience. I absolutely hated it and it spoilt the Disney illusion. The mickey mouse train to and from was the best part of this experience.If visiting be prepared to be pushed out the way and people to queue jump and dirty looks when you won't let people past or you tell them there is a queue. There is no such thing as personal space either. Whilst in the queue the people behind were that close you could feel the spit on your back as they were talking.Save your money and visit ocean park!!,Disneyland_HongKong,9,park disnei ride disneyland time visit hong dai queue small peopl food hk kong wait
387,163409308,1,2012-11,United States,Too Small and Overcrowed with Obnoxious Visitors from the world's most populous country who have no manner and don't know what civilization mean.  The place itself is very small (too small) compared to other Disney property around the world,Disneyland_HongKong,9,park disnei ride disneyland time visit hong dai queue small peopl food hk kong wait
388,162796683,2,2012-7,Philippines,We were in line for the picture session with Mickey when they park attendant cut the line and said that it's over. I requested for at least one shot as it was my daughter's birthday but I was ignored and it was as if I was not heard.,Disneyland_HongKong,9,park disnei ride disneyland time visit hong dai queue small peopl food hk kong wait
389,160878145,2,2013-4,India,"HKD 450 for adults, 320 or children is an outrageous price for HK Disney. It completely lacks the Disney Magic and is so small that I could not believe they could charge so much for this tiny park. Take the main Castle for instance. The one in Florida looks like a real castle while this one looks like a miniature put in for the sake of making it look like a Disney theme park. The overall feel of Disney is completely missing from HK Disney. It just does not seem magical at all! The rides barring 2 or 3 are really lame...good for a 5 year old perhaps.The Grizzly bear ride was nice and the fireworks show is good at night. They have provided plenty of water fountains which is good. Snacks are expensive (HKD 35 for a small popcorn or HKD 28 for cotton candy). Inspite of reports that Disney wont allow you to carry your own food, we took plenty of it. I would have strongly argued that they cant decide what I should eat and what I shouldn't and cannot stop me from taking my own food inside (we are vegetarian so our choice is extremely limited in such places) . They looked at my bags and the food but didnt stop me from taking it in.My honest suggestion is for people to visit Ocean Park. Half the price, 10 times the size (no exaggeration) and much more entertaining. My kids agree! This is especially true if you are planning to visit Disney in Florida anytime in your life. Dont waste time on HK Disney.As of early May if you bought tickets with a VISA card, you could get 11% off at the ticket booth outside Disney. Also bear in mind that all restaurants in the park close when the park closes. This means if you wish to have dinner, it has to be  instead  of the rides. They wont serve anything post the fire works show.",Disneyland_HongKong,9,park disnei ride disneyland time visit hong dai queue small peopl food hk kong wait
390,160638153,2,2013-4,New Zealand,To be honest   its for kids. Ocean Park is a lot more fun. Nice and clean but as expected   expensive for what you get.,Disneyland_HongKong,9,park disnei ride disneyland time visit hong dai queue small peopl food hk kong wait
391,159411630,2,2012-11,Thailand,The area is very small. I can say smallest disneyland. We can finish all park within half a day. There are not many rides and no ride for mature!,Disneyland_HongKong,9,park disnei ride disneyland time visit hong dai queue small peopl food hk kong wait
392,158916503,2,2013-4,Hong Kong,"Pros: If you like Disney stuff you'll have fun at any Disneylands. The Buzz lightyear (laser tag guns) attraction is fun. The Lion King show is really good too.Cons: Lots of rude park guests. One of if not the smallest Disneys. Also, quite far from town (it is near the airport) so if a is airport d is disney and tc is town center, it is like this:a....d....................................tcThere are lots of Chinese mainlanders   I think these are the main source of revenue for the park   so prepare to be shocked by the cultural difference: constant queue barging, invasion of personal space when they are forced to queue (they will probably be sniffing the back of your head or rubbing against your backside)   as if this shorten the queue time, people smoking outside designated areas, ill mannered kids screaming, littering and running around AND on your lucky day you might see the Disney parade as well as the golden showers or golden poop parades performed by Chinese kids.The goods: Buzz lightyear, Lion King show.Tips: Go on weekdays. Avoid queueing with rude looking park guests (the Chinese mainlanders). Get fastpass. The park is REALLY small so if you see a sudden long queue at an attraction, just come back later. It'll save you a lot of time.",Disneyland_HongKong,9,park disnei ride disneyland time visit hong dai queue small peopl food hk kong wait
393,158727567,2,2013-3,Australia,Im afraid I was very dissapointed in HK Disneyland. More retail outlets than anything else.  the show i saw (The lion King) was spectacular. the rest was just below average. I wasnt there with any kids so maybe  my views are a bit harsh.,Disneyland_HongKong,9,park disnei ride disneyland time visit hong dai queue small peopl food hk kong wait
394,158466880,2,2013-4,Australia,"Went here in April 2013 and I was not impressed... or more like disappointed. Getting there is so easy, just take the MTR to Sunny Bay and change to the Disneyland Express. Journey takes about 30 minutes from central Hong Kong. The train is fab and so is the station and the entry... but that was kind of  it  for me. It was a cloudy day, not much people and no real queues to talk about but it took us approx 20 minutes to get tickets to get in, then there was the security line to check the bags. Not a problem but I can imagine the chaos on a busy day. You walk into Main Street and well.. its a street full of shops selling Disney merchandise and sweets... even the bread is sweet and finding anything else became a challenge. We saw Mickey and went to get a picture just to get told that the waiting time was 1.5 hours so we gave up. We worked our way around just to find 3 of the major attractions  closed for reconstruction   sorry for your inconvenience ... doesn't help me when I paid almost $70 AUD to get in. Where was the signs at the gate that some attractions are closed?It doesn't really take a lot of time to walk around, I was looking for Disney characters or themes, but I found it scarce. All day I saw Mickey once and Minnie once as well and that was it! Its supposed to be like walking into the  World of Disney , but this was more a  sell as much Disney merchandise as we can , a few half bad attractions on the side and some nice gardens. Another thing were the waiting times... as I mentioned, it was a slow day, not many guests but the wait was still about 15 minutes on most rides... as said before, I don't want to be here on a good day... I have to say that the Gulf was a really good ride but the rest of the ones that were open I could do without. I think that if you have young children and you don't mind lining up and waiting it could probably be a fun day out, but not for the older ones. To me it was more of a half bad amusement park.",Disneyland_HongKong,9,park disnei ride disneyland time visit hong dai queue small peopl food hk kong wait
395,157107697,2,2012-11,China,"Was my first time to Disneyland, even from a small country, we only have one theme park and I thought it was just so so. This would be great if you were a kid, but it was not as good as I thought. The best ride was being fixed up for Halloween, so very disappointing, still had to pay full price.Strange there were lots of HK businessmen in suits... hmm place for business trips?I didn't even stay for the fireworks at the end, only stayed an hour or so then left...",Disneyland_HongKong,9,park disnei ride disneyland time visit hong dai queue small peopl food hk kong wait
396,153744812,2,2012-10,Australia,Have been to Disney Anaheim and Tokyo and this effort is a poor third. Little kids 3 8 will get a fun day but for the rest it does not offer a lot.,Disneyland_HongKong,9,park disnei ride disneyland time visit hong dai queue small peopl food hk kong wait
397,153446919,2,2012-9,Singapore,"Lots of queue cutting from China mainlanders, decent touristy food. Ticket price should lower due to difference in quality from their counterparts from US.",Disneyland_HongKong,9,park disnei ride disneyland time visit hong dai queue small peopl food hk kong wait
398,153002857,2,2012-3,Indonesia,The park is too small compared to Japan Disney...the rides are not interesting for adults. The worst part is that I encountered some occasions when other visitors tried to cut lines...it was so annoying...the only part that highlighted my visit when I saw firework performance at night time.,Disneyland_HongKong,9,park disnei ride disneyland time visit hong dai queue small peopl food hk kong wait
399,152532686,2,2012-3,China,"I was at Disneyland a while back and there are pluses and minuses. On the plus side... if you have kids, they will love it, they have decent rides, their small Disney village is cute and there is beauty all around.On the negative side, it's smaller then I expected, not as many rides as I thought and the queues are very long.",Disneyland_HongKong,9,park disnei ride disneyland time visit hong dai queue small peopl food hk kong wait
400,151548386,2,2013-1,Australia,"We came here not knowing what to really expect as we had heard mixed reviews from friends about DL HK. After visiting, I can say this theme park is really catered towards young children as rides and very tacky, uninteresting and not thrilling.   My title...More",Disneyland_HongKong,9,park disnei ride disneyland time visit hong dai queue small peopl food hk kong wait
401,149638574,2,2012-7,Indonesia,"I am not Singaporean, but I can not find better word to explain Hongkong Disneyland. I expect something more grander and big, but I am so dissapointed to see the castle is so small, just like a gate or stage only where it is suppose to be like in a fairy tale. 3D show is blurr for my eyes, and all other game is dedicated only for small children. It is not bad, but also not amazing for me.But I love the food here, it is good and have many variety.....",Disneyland_HongKong,9,park disnei ride disneyland time visit hong dai queue small peopl food hk kong wait
402,148555726,2,2012-12,Philippines,"My family always celebrate Christmas and New Year in Hongkong. Even some of the staffs are not that friendly, we still go there beacuse this is the closest disneylandfrom our country aside from the fact that my children are still happy when they are here (yes, bec they arekids ages 10, 8 and 7).Our latest visit was yesterday JAnuary 1, 2013 and dec 31, 2012. Yesterday was really a bad experience for us. First, we have experienced some of the local residents pushing while we are on queue. But we still manage and kept our composure. But when we arrive at the Toy Story Land (The parachute ride to be exact), the two families in front of us while we are on queue fight. Because of the long queue the two hot tempered family did not stop fighting until the securities came in. We didn't know what happened next because we ride already. But the saddest part of all is when we bought a lot of souvenirs from the souvenir shop in the Main Street near the exit. I know and i check that I gave the cashier 3 pcs of HKD1000. OUr total bill is HKD 2,268.00. But to our surprise she just gave me a change of HKD 232.00. I ask the cashier and I said that i gave her HKD3,000. She said no and insist that i gave her HKD2,500.00. The lady beside her, i think the supervisor counted the money in the cash register and so we waited. And to our surprise again, they said that our change is correct. We counted again our HKD in my wallet and we are very sure that we gave her HKD 3,000.00. We know, because all our expenses and the HKD that we changed in their money changers since December 29, 2012 are all accounted.We were so disappointed.Lesson learned, when you pay count in front of the cashier and tell her how much money you gave her.",Disneyland_HongKong,9,park disnei ride disneyland time visit hong dai queue small peopl food hk kong wait
403,148079519,2,2012-12,Philippines,"this is my 2nd time at disneyland hongkong. first of all, if u have been to disneyland orlando u will be severely disappointed since hongkong disneyland is very small. u can walk around it in just an hour. upon entering u will have the option of getting the star pass, if u don't mind paying an extra 100 hongkong dollars per person. ticket is 399 hk dollars for adults and 285 hk dollars for aged 3 to 11 years old. let me tell u about the good stuff first. view is very nice, the parade was fun to watch but it was a short one only around 5pm if i am not mistaken. now to the bad part... oh my! i am going to start my whining. terrible food! i bought an assortment of food like hotdogs, waffles, chicken wings and pizza. waffles was decent, the other selections was horrible. i was left hungry since it galls me to buy overpriced unsavory food. disneyland staff are ill mannered and rude, and to top it off they barely speak english argh! their guttural and incoherent sentences made me stop asking questions. to be fair to them, maybe they seem rude bec they barely speak english so they can't communicate properly but still... i expected better from disneyland staff. some of the staff kept on hurrying small kids that might make them have an accident like falling etc. which in my opinion is not right. queues are very long, u have to wait for an hour per ride and then it will only take 3 to 5 minutes for u to finish the ride :( my son still enjoyed his time in disneyland, he is 7 years old so no surprise there. my tip is this, eat first before u step on disneyland. terrible food!",Disneyland_HongKong,9,park disnei ride disneyland time visit hong dai queue small peopl food hk kong wait
404,147671226,1,2012-12,Indonesia,"Brought my whole family, kids, brother, nephews and niece to HKD land on Dec 17, 2012. Was my 3rd visit to the park. Off from Indonesia  a 5 hour sky distance from HK  we were all geared up for a full day of fun. Kids were looking forward to it, a full pay off after midterm exams. That morning, we came early with loads of kids' neccessities and my personal photographic gears. Kids' stuff included raincoats, spare clothes  as it was pedicted there would be light showers and for getting prepared for some wet actions. My personal photographic gears included those heavy full frame DSLR body and lenses  as my visit to the park wouldn't be complete without taking some great shots of my family with famous backgrounds such as Disneyland.I packed all those gears in one plane cabin sized roller bag, thinking that it would be too heavy to carry around. What an unpleasant surprise I received from the gate attendant that morning, instructing that I should take out all the heavy gears and leave the roller bag at the deposit counter outside the park at HKD 60 fee. It wasn't the fee that made me upset, but the fact that they commanded me to carry the heavy loads without a roller bag. They even said:  You could take turn carrying them since you have 10 people with you!  What a statement! I thought to myself:  Doesn't she see half of my group consists of children? What a thoughtless statement to have small children carrying heavy loads around while they should have fun riding and enjoying the park's variety of treats and snack? What disappointed me was that there was no precaution whatsoever made to me prior to my coming  whether on the website or at the tickets agency that visitors should NOT bring any roller bags into the park. I ended up carrying all the heavy loads around on my back. Imagine bringing those around for 11 straight hours! I could not enjoy one bit of my visit to HK Disneyland this time, even though still trying hard to take good pictures. We went back home with my back hurt. It was such a hurtful treat from the staff at Disneyland having such a mindless service to visitors like us. I do not know the rationale behind this rule. I could only guess  it could be for security purposes, or commercial purposes. The latter being to stop visitors for not spending to purchase foods offerred from inside the park, if they bring ones from outside.I do not know exactly their reasons, but one thing that had left me with after visiting the theme park, and that is being hurt and disappointed. For those with similar case with me, I suggest they call in first or better still, do not carry heavy loads into the park. You never know what they will surprise you upfront, when they should surprise us during the park experience with great times!",Disneyland_HongKong,9,park disnei ride disneyland time visit hong dai queue small peopl food hk kong wait
405,147279878,2,2012-8,Canada,This one sucks compared to the Ocean Peak. The park has very little to see. We spent like 4 hours in the park and already see everything we are interested in. If you have been the Disney World in Orlando then you can safely skip this one.,Disneyland_HongKong,9,park disnei ride disneyland time visit hong dai queue small peopl food hk kong wait
406,146799140,2,2012-4,Thailand,"The tickets were quite expensive but we didn't mind speding bcoz here's the first place I planed with my friend to go when arrived HK. ,, it's worse than we thought!! Disney Land is quite big.,You might be able to see all the sights in a half day munimum and that day was raining then we just walked around until my friend wanted to see Winnie the Pooh.We expected less crowded but we were wrong,the long queue awaited.....around an hour more and took us around only 10 mins visiting inside!! OMGzzzzz ....really disappointed! We will never go back again ...TT",Disneyland_HongKong,9,park disnei ride disneyland time visit hong dai queue small peopl food hk kong wait
407,146503983,2,2012-11,Norway,"we stopped by while in transit. taxi from the airport to disney land is only about 100 HKD. if you show your flight tickets at the entrace you will get nearly 50 percent on the ticket.we spent about three hours and felt we had done it all in that time. the park is very small, and there are not many rides. it was ok to walk around, but really not much to do. guess it is fun for small children, but for grown ups the park is to small.",Disneyland_HongKong,9,park disnei ride disneyland time visit hong dai queue small peopl food hk kong wait
408,144670723,2,2012-11,United States,"This trip ruined my childhood memories of Disneyland so I would only recommend it if you actually have little ones.There were so many tourists and some of them were pretty rude   shoving in and queue jumping and talking really really loudly.THe rides are boring. If you are after some adrenaline pumping rides at a far cheaper entrance fee, go to Ocean Park.",Disneyland_HongKong,9,park disnei ride disneyland time visit hong dai queue small peopl food hk kong wait
409,143502464,2,2011-12,Philippines,"It is over rated. There are limited rides and very few restaurants with wholesome meals. Prices at souvenir stores are expensive. Be careful of having your pictures taken for it will cost you from HK$100 HK$150 per photo. Better bring your own camera for your souvenir pictures. On the good side, the amusement park is safe and clean even at night time. They have friendly staff and the fireworks are spectacular.",Disneyland_HongKong,9,park disnei ride disneyland time visit hong dai queue small peopl food hk kong wait
410,140578388,1,2012-9,Hong Kong," I must say that my wife and I had the most miserable experience in the HK Disneyland last Sunday, September 16th, 2012.  I am not trying to compare, though I have gone to the LA Disneyland 7 times.  I fully understand that the land allocation...More",Disneyland_HongKong,9,park disnei ride disneyland time visit hong dai queue small peopl food hk kong wait
411,140165217,2,2012-4,Hong Kong,"way too much tourists from mainland china. cannot stand some of the in cilvilised and inconsiderate behaviours by some of them. coughing, spitting, shouting, children pee just on the street.... but i think this happen every where they go. not just only disney land, it is just the fact that disney land is a hot tourist place for mainland tourists....",Disneyland_HongKong,9,park disnei ride disneyland time visit hong dai queue small peopl food hk kong wait
412,138676838,2,2012-8,Japan,"Such a bad experience. 90% were mainland china tourist, lots a pushing a shoving, queue jumping in shop, stall, rides and even toilets. The mainland folks have no concept of queuing. Place was dirty, chicken bone everywhere. Staff unhelpfull, no corwd control, no visible security.They should have build this up in China.I recommend you skip HK and go to Japans Tokyo Dinsey Resort.",Disneyland_HongKong,9,park disnei ride disneyland time visit hong dai queue small peopl food hk kong wait
