,Review_ID,Rating,Year_Month,Reviewer_Location,Review_Text,Branch,dominant_topic,feature name
282,263534797,2,2015-3,Philippines,"We went to disney hong kong as a lot of people say is very nice. We went on monday which was a good choice because it was not busy. When we came in and arrived at main street i excpected that this where real buildings but most of them are just front panels with on top plastic printed canvas looked cheap. As we are a family of 3 and our kid is 11 years old he looks for rides but all in all there where maybe 8 or 10 rides which he likes or are fun for him. We Walked all the park and within 4 hours you seen every thing. You would think the disney figures would walk the park but no. Also most of the buildings are either food kiosk, restaurants or souvinier shops. The best area is adventure land which is setup nicely. If you are in hong kong and you want to go to attraction go to ocean park much better. For the price 499 for adult it was a disapointment",Disneyland_HongKong,9,park disnei ride disneyland time visit hong dai queue small peopl food hk kong wait
283,262961360,1,2015-3,Costa Rica,"Compared to Orlando, California and Paris, Hong Kong Disneyland is a really small parks. You won`t find a lot of the typical rides in other parks. There is no Cinderellas Castle, it is more like a painted wall. The worst is the PHOTOPASS: unlike all the others Disney Parks is that you have only 24 hours to retrieve and buy your photos, not the 30 days given in the other Disney parks. So we went all the way from Costa Rica, and we realized that we lost all our memories just when we came home. They must save all the photos more time like the other Disney Parks.",Disneyland_HongKong,9,park disnei ride disneyland time visit hong dai queue small peopl food hk kong wait
284,262404987,2,2015-3,United Kingdom,"We booked our 2days pass tickets in UK via the web site before our holiday in HK. It's really for our 3year old daughter as I've been to the one in Paris and Florida and thought it would be nice to spend some family time in a magical place.Good job we got a 2days pass as the following attractions rides were out of order: lion king show, run away mine train and slinky ride at toy story land. Hopefully lion king show will be available on our 2nd visit.Didn't realise you have to obtain some form of token to be able to join the queue to take photos with the Frozen characters so when we arrive at the area at 2pm we were told all token pass for the day have been all given out and we will have to come back another day.Fingers cross we can get a token on our 2nd visit tomorrow. Overall the Disney experience isn't one of my best in HK, and the park isn't big enough to spend a whole day with the family.",Disneyland_HongKong,9,park disnei ride disneyland time visit hong dai queue small peopl food hk kong wait
285,261803942,2,2014-11,Hong Kong,"HK Disneyland has a relatively small amount of rides compared to other amusement parks. It will be amusing for children till the age of 12 maybe, but teenagers will not find it fun. Most you will need to spend is around 3 hours at the park.",Disneyland_HongKong,9,park disnei ride disneyland time visit hong dai queue small peopl food hk kong wait
286,261135485,2,2015-3,Singapore,"We were very disappointed with the fake Cinderella painted on cardboard... It really spoiled the experience (and our pictures) for our trip... Shame on you HK Disneyland, that is just not right, with all the money you make, the least you can do is have a proper castle as the center of your park!",Disneyland_HongKong,9,park disnei ride disneyland time visit hong dai queue small peopl food hk kong wait
287,259199585,2,2015-2,Indonesia,"I've been here twice already. So I get a bit of a comparison. Attraction wise not much have changed since my first visit around 5 years before. So it seems that HK Disneyland does not progress very quick. It even has less entertainment going now. Previously there are lots more entertainers going about the park, such as the princesses taking photos with the kids, bands using garbage can, guys on stilts, and so on. The second time, we only got Chip right beside the entrance taking photo, and later on Stitch in the area. No other entertainer met during our whole day there. and it seems a massive decrease of entertainers compared to 5 years ago. That's a let down for us and our kids, since we are hoping to meet a lot of characters from the Disney World.But the real problem lies in the queues. On average we need around 30 40minutes queuing time for each ride. and there are no express lane. there is a system of gaining a fast pass ticket for some of the more popular rides, where it states at what time you should get back to have fast entry to the rides. although this is quite good, the problem is you cannot get any other fast pass before the one you held earlier expires... this is a major problem. For example, I took a fast pas on 12pm, and the fast pass state that I need to get back to the ride at 2.30 3.30pm. now this is definitely too long (2,5 hours) so I need to get back to the ride at 2.30pm and ride it (or wait until it expires at 3.30pm) before I can take another fast pass to another ride. you can imagine if I take another fast pass at 2.30pm it will require me to get back again at 4pm. that is too long. and in the meantime via the regular queue we still have to stand in line for 40 minutes each. I spent too much effort while i was there trying to be effective with my time there. I NEED to be effective since I'm there with small children (as with everyone else). after 3 times queuing for 40 minutes each, children will get cranky for taking so long to ride just one attraction. We also got an incident with another group of people that try to cut our queue. We were there patiently waiting in line and trying our best to control our children so that they can also wait patiently in line, and then another family (that doesn't speak English too well) tried to cut in front of us. that is the last straw and we had a scene. although this is not Disneyland direct fault, they should have staff and attention board to notify that everybody should queue in line and may not cut in front of anybody else. this is particularly needed since the influx of non English speaking tourists that tends to also have no decent manners in modern society.overall, Disneyland Hong Kong should not use the tag line  happiest place in the world  anymore. We are definitely not happy while there.",Disneyland_HongKong,9,park disnei ride disneyland time visit hong dai queue small peopl food hk kong wait
288,257097884,1,2014-8,United Kingdom,"This was my first time going to a disneyland and I never expected it to be that bad. Firstly, HKD is way too overcrowded and they don't limit the amount of visitors there is a day, I believe that 200 people should be the maximum since I only went to a couple of rides: space mountain ( fast track ticket ) , Buzz lightyear astro blasters, jungle river cruise, Autopia, It's a small world, stitch encounter and slinky dog spin. For me, the stitch encounter and the slinky dog spin was the worst because the stitch encounter was basically watching Stitch talk and having a chance of talking to him ( on screen, for children ) and I thought it was a ride, the que was horribly long ( 1 hour on a hot day ) The slinky dog ride was very bad either, 45  minute que to go on a dog ride ( 3 4 laps of a a circle ) which made the ride less than 1 hour. However, I do recommend Autopia, space mountain, astro blastersand the jungle river cruise. On the other hand, the food there was disgusting and dry which costed 98 hong kong dollars ( equivilent to   9.80 uk money ) What a rip off       . The staff had bad manners, the one i experienced was the one in the jungle river cruise. Somehow, they show disrespect to mainland China people since my family and I split the group in half because half of us wanted to rest and half of us wanted to go on rides, so they found a ride and they called us to go and when we reached there they didn't let us through since they thought we were que cutting but my family was at the front of the que and they were talking disrespectfully to my uncle as his first language is mandarin but his cantonese is good. But, when my mum came and spoke cantonese they went silent and let us through. Here we can the see the discrimination between hongkongese and chinese mainlanders. Also, people from south west china have better manners than mainlanders so I don't understand why they think we are mainlanders. Im from the UK and find this a rasict. In conclusion, I found HKD terrible, I do not reccomend HKD to people because of the overcrowded visitors. The positive thing about this trip is that you get to watch the 9:00pm fireworks and get to LEARN YOUR LESSON. The park opens at 8:00 or 9:00 and closes at 10:00 but when my family arrived, there were a bunch of people already there. Also, be careful since you are at risk of having your children lost. From a review of a teenager from the UK.",Disneyland_HongKong,9,park disnei ride disneyland time visit hong dai queue small peopl food hk kong wait
289,255187661,2,2014-12,Hong Kong,"Overcrowded, overrated, overpriced.  You should go to Ocean Park instead. More authentic. Never too commercial.  Forget about the Disney dream.",Disneyland_HongKong,9,park disnei ride disneyland time visit hong dai queue small peopl food hk kong wait
290,254956949,2,2014-10,Thailand,"I went to Disneyland in US,France and Japan. Here is the smallest compared with all I mentioned.The parades and characters are ok for small kids.The place is crowded with people form mainland China. We had to wait for the long long time.Facilities are alright. Nothing much to buy in souvenir shop.There are not enough shade in the hot day that make us so tired.Avoid if you have chance to visit disneyland in other countries.",Disneyland_HongKong,9,park disnei ride disneyland time visit hong dai queue small peopl food hk kong wait
291,254781262,2,2014-12,Hong Kong,"This is relatively small compared with other Disneyland in the world and packed with tourists from Mainland China 365 days a year. The park itself is ok but if you come from a country with your own Disneyland, skip it in your itinerary.",Disneyland_HongKong,9,park disnei ride disneyland time visit hong dai queue small peopl food hk kong wait
292,254779757,2,2015-2,Hong Kong,"Hong Kong Disneyland is very small in comparing with the Tokyo or in the US. So many people that you have to queue at least two hours for a single activity. Normally, you can have enjoyed one or two activities in the morning, then, find places to eat, then another one or two activities in the afternoon. Then if you want to see the fireworks, you should buy some snacks and then go to find your places to wait. Beware that it is so crowed that you have to wait and wait and wait.And, one more thing you must make sure you don't mind, there are too many visitors from Mainland China, their behaviors, sometimes, are examining your patience and tolerance level.If you can go to other Disneyland, Hong Kong Disneyland is absolutely not your first choice to visit.",Disneyland_HongKong,9,park disnei ride disneyland time visit hong dai queue small peopl food hk kong wait
293,253912229,2,2015-2,Malaysia,I think i had been ripped off... went to HK Disneyland and found that the train ride was not available and the Cinderella Castle was made up of Cardboards (upperhalf) but they still charged full price on the tickets...,Disneyland_HongKong,9,park disnei ride disneyland time visit hong dai queue small peopl food hk kong wait
294,253712578,1,2015-2,United States,"Park is ok can't fault it really. But the whole time being there had been ruined by those from mainland China. Europeans don't waist your time here, stay close to home and go Paris. Try to que for rides I not even joking mainland wild animals will rip you apart to jump the que. they'd use all kinds of ways to get in front of you. shame staff can't do nothing bout it but I do understand why. They rely on them to make money more then Europeans.",Disneyland_HongKong,9,park disnei ride disneyland time visit hong dai queue small peopl food hk kong wait
295,253135117,1,2014-12,Hong Kong,"Worst amusement park ever.  Huge parking fee (120 for motorbike), same for the entrance fee, and the attractions inside are crappy. Food isnt great but that's not what you're coming there for...  Not a good experience.  Ocean park is much better",Disneyland_HongKong,9,park disnei ride disneyland time visit hong dai queue small peopl food hk kong wait
296,251388598,2,2014-12,Australia,"We took our young kids (9, 7 & 4). I thought it was highly disappointing, expensive and the food was awful. Your choices of food were Asian cuisine or Western fast food crap. That was it. We were dying for something fresh.The park itself, the kids were bored of after half a day. It is a very small theme park, not what you expect from a Disney franchise. The theme parks at the Gold Coast are bigger and have more for everyone. When I asked the kids what their highlight of their 3 days in HK was, they all said the cable cars and the Buddha Temple. Go there instead!",Disneyland_HongKong,9,park disnei ride disneyland time visit hong dai queue small peopl food hk kong wait
297,250231885,2,2014-4,Canada,"If it weren't for the lineups, it would take me like 3 hours to go through every thing. The park is really small in compare to other Disneyland parks. There were only a handful of rides you can go for and they are mostly for children 6 years or under. The experience was not impressive and I wouldn't go back in the future at all.",Disneyland_HongKong,9,park disnei ride disneyland time visit hong dai queue small peopl food hk kong wait
298,249217785,2,2015-1,Australia,"Very Disappointing. It took near on two hours of lining up just to get in. Once inside we did not end up going on any of the rides as the signs said the wait time for all rides were around 1 to 1.5 hours. The crowds in the lines and around the park itself were overwhelming. We were expecting to see Mickey Mouse and other Disney folk walking around and mingling with the crowds to add to the atmosphere of Disneyland, however we only saw these characters in the opening parade. After a long exhausting unadventful day of seeing practically nothing and with a two year old who was worn out from all the waiting and walking and still waiting to see  Mickey Mouse  we ended up leaving before the night parade and fireworks. We went on a Friday so maybe if we had gone on a weekday it may not have been as crowded.",Disneyland_HongKong,9,park disnei ride disneyland time visit hong dai queue small peopl food hk kong wait
299,248396708,2,missing,New Zealand,I went to Disneyland with my family some time in October and I didn't really like I arrived at 11AM and left at about 4PM because it was boring. There were only a few rides and they lasted for a few minutes. The only person that was available to take a picture with was Mickey Mouse. Their were no other characters to take pictures with. The staff were a bit rude.Don't think I'll ever be returning to this Disneyland again.,Disneyland_HongKong,9,park disnei ride disneyland time visit hong dai queue small peopl food hk kong wait
300,247981149,1,2014-12,Singapore,"There are five themed areas within the park. Each section has one or maximum two high thrill rides, the rest are for little kiddies. There is insufficient seating for those who purchase from the take out vendors (forcing you to sit at an EXPENSIVE restaurant). All food is overpriced. Some staff don't understand English. If there were more rides for older children and adults, this could be a value for money destination. I must apologise as I am comparing HK Disney with Disney Orlando!",Disneyland_HongKong,9,park disnei ride disneyland time visit hong dai queue small peopl food hk kong wait
301,247334091,1,2015-1,Argentina,"No animatronics.. no nothing. The mini castle is a joke. When will Disney stop making money with this nonsense? They don t use the technology available today to create magic, as Walt used to do in the past. A forever gone era it seems. They can go on opening gift shops... they don t have the creative gift Walt Disney have.And in Hong Kong it s most noticeable. It s a shame.Take your children to the Science Museum in Hong Kong it s wonderful.",Disneyland_HongKong,9,park disnei ride disneyland time visit hong dai queue small peopl food hk kong wait
302,246619975,2,missing,Hong Kong,"It was a very good place to visit back then, but now it is getting unorganized and the environment getting  polluted    dirty by groups of uncivilized local tourist making the place so uncomfortable to visit now. Any chance to monitor this?",Disneyland_HongKong,9,park disnei ride disneyland time visit hong dai queue small peopl food hk kong wait
303,245849346,2,2014-1,United States,"HK disneyland is small and not very good. For starters, about half of the buildings on main street USA were wall paper of buildings and not real buildings themselves. It is only worth it for those that have never been to any other Disney Park as this is the worst one of all. I have been to all other Disneyland Disney Worlds, and always felt that one day wasnt enough. With Disney HK, I saw all the attractions and rode all the worthwhile rides in about 3 hours.",Disneyland_HongKong,9,park disnei ride disneyland time visit hong dai queue small peopl food hk kong wait
304,243774746,2,2014-3,Hong Kong,"Hong Kong Disneyland is tiny but yet costly.Very few selection of rides and need to queue for quite some time.In order to spend time more efficiently, I suggest going there after lunch or even later in the afternoon for following reasons (if you won't go for all the rides):1. Avoid overhead sun2. Save money on food and drinks in the park3. Do not need to wait for hours for the night parade4. Great sunset",Disneyland_HongKong,9,park disnei ride disneyland time visit hong dai queue small peopl food hk kong wait
305,243644355,2,missing,Germany,Payed 150 USD for 2 adults & a kid.   It's only to make money & the amusement is not so special.   If you want to eat or drink calculate a lot of money. It's wasting time there.,Disneyland_HongKong,9,park disnei ride disneyland time visit hong dai queue small peopl food hk kong wait
306,241028517,2,2014-2,Thailand,"If you have visited the Disney parks in America, this will be a major disappointment. For example, Main Street did indeed have storefronts on one side of the street, but the other side was a painted canvas! The main Disney Park features are there, but the quality is so poor it does not create the illusion I associate with a Disneyland experience. What was of interest to me is the park was built taking into consideration Feng Shui. If you are a Westerner visiting this park, take the time to understand this feature of the park to distract you from its shortcomings.",Disneyland_HongKong,9,park disnei ride disneyland time visit hong dai queue small peopl food hk kong wait
307,240225632,1,missing,Singapore,"We thought Disneyland is supposed to be one of the happiest place on earth but it is definitely not true in Hong Kong Disneyland. We encounter several rude and unhelpful staff especially in the disney shop inside disneyland. The sales staff display bad, unhelpful attitude when my wife ask him question in mandarin nicely. His attitude only improve when she eventually speak to him in English. We can feel the distinct discrimination to Chinese especially to those from mainland. But being in the service industry, this should not even happen. Having been to other Disney theme park in florida and LA, I must comment that the experience in disneyland hong kong is unexpected and disappointed. Your staff just spoilt our day. Lousy!!",Disneyland_HongKong,9,park disnei ride disneyland time visit hong dai queue small peopl food hk kong wait
308,240139958,2,2014-11,Australia,We didn't like this very much. We were so excited to be going to Disneyland and had prebooked a 2 day pass and didn't even stay for one full day. If you want to buy select Disney products   it is good (not all though). Every  shop front  was another gift shop. ,Disneyland_HongKong,9,park disnei ride disneyland time visit hong dai queue small peopl food hk kong wait
309,239231487,1,2013-12,Hong Kong,"This park, according to people who worked there, was built with one segment of market in mind: the Mainlanders. The rides in this park, therefore, are not as exciting as the ones found in other Disneylands. The park was built so that people could merely take photos, and walk around as that was what the market research resulted. Save your money for a real one. The place is too crowded, and too uncivilized, and sanitation suffers.",Disneyland_HongKong,9,park disnei ride disneyland time visit hong dai queue small peopl food hk kong wait
310,239160649,1,2014-10,Australia,"I am so glad that I have been lucky enough to go to the parks in the states and Disneyland Paris. This allowed me to compare this park to the others. Our family of 4 with two teens included have now been to all parks apart from Tokyo. Our least favourite park was HongKong in fact it was the bottom of our list by a long way. We disliked the food that may have been the fact that we prefer western style food. The small amount of western food available was poorly done in fact my daughter fed most of hers to the birds. The park itself was clean and pretty but small and the staff lacked personality. The castle was small and I felt lacked the feeling you get from the other parks. We did enjoy the Mystic manor and was my favourite ride, we also enjoyed the addition of the Disney characters in its a small world but apart from that we were disappointed with the rides. My children said space mountain was the worst one in all the parks they had visited. The merchandise available was also boring and lacked variety compared to other parks. If this is to be your first time at a Disney park dont bother save for a little longer and go to one of the better parks. As you can tell I was disappointed maybe if I had nothing to compare it to I would have felt differently.",Disneyland_HongKong,9,park disnei ride disneyland time visit hong dai queue small peopl food hk kong wait
311,236447664,2,2014-10,United States,"If you have extra money to burn and extra time to kill and have never been to another amusement park   then you might enjoy this one. If you have ever been to almost any other park   and if you are from the USA and have even been to a large county fair   you will be disappointed. The few rides there are are very short (slinky dog ride in Toy Story land only made 6 loops around the tiny track, swinging race car ride only swung 3 times). Space Mountain is not similar at all to the one in Orlando, and the two other rides geared more towards older kids (Grizzley Gulch roller coaster and Mystic Manor) were both closed due to technical issues the day we were there. This park does not have that many rides that are of interest to kids over the age of 8 9. Mickey's Philharmonic show was good. We went during the Halloween special time of year and did go through one of the walk through haunted houses and it was ok, but the line was so long for the second walk through haunted house we did not go to it (over an hour wait). The scary storytelling session was  sold out  so fast we did not get to go to it either.The food at this park is way below expectations for a Disney Park. At the suggestion of the staff members (who we ask where are the best places to eat), we went to Royal Banquet Hall and also at the Explorers Club. We are very open to new foods   seek them out in fact   but Disney did not come through with these offerings   blah, and uninspired.Staff members were nice and honest. They told us a one day pass was enough, not to buy two. They told us to just buy 2 of the special 3 for 1 price dining coupons and share with our kids   and they were right that was the best thing to do (guess they knew we would be less than impressed with the food). Restroom on the Tarzan Treehouse Island was in terrible condition (dirty). Other restrooms we went to were acceptable.Over all, unless you are a huge Disney fan and want to check this off as a Disney Status been there   done that park type thing, pass this up and go to another amusement park.We went on a Friday in October and the weather was great, the lines for rides (the ones that were open!!) were good in the morning, but by 2 by they were silly long.",Disneyland_HongKong,9,park disnei ride disneyland time visit hong dai queue small peopl food hk kong wait
312,233452465,2,2014-10,United Kingdom,"Having been to Florida and Paris Disney land previous to this I would say it is pretty poor. The resort is very small, less than half the rides and more aimed towards small children. I was more disappointed that it wasn't decorated more for Halloween, it had the odd decoration and the themed rides. As it is Disney I thought they would go all out. Good if you haven't been to the other Disneys and have small children.",Disneyland_HongKong,9,park disnei ride disneyland time visit hong dai queue small peopl food hk kong wait
